{
  "$schema": "http://json-schema.org/draft-07/schema#",
  "$id": "https://owf.app/schemas/feed-card",
  "title": "FeedCard",
  "description": "Schema for a feed card in the OWF (One World Feed) feed",
  "type": "object",
  "required": ["id", "type", "title", "source", "timestamp"],
  "additionalProperties": false,
  "properties": {
    "id": {
      "type": "string",
      "description": "Unique identifier for the card",
      "minLength": 1
    },
    "type": {
      "type": "string",
      "description": "Content type of the card, determines layout and accent colour",
      "enum": ["news", "music", "social", "live", "podcast", "ai"]
    },
    "title": {
      "type": "string",
      "description": "Primary headline or title of the card",
      "minLength": 1,
      "maxLength": 280
    },
    "source": {
      "type": "string",
      "description": "Publisher, broadcaster, or creator name",
      "minLength": 1,
      "maxLength": 100
    },
    "timestamp": {
      "type": "string",
      "description": "ISO 8601 date-time when the content was published or created",
      "format": "date-time"
    },
    "summary": {
      "type": "string",
      "description": "Short excerpt or description of the content",
      "maxLength": 500
    },
    "url": {
      "type": "string",
      "description": "Absolute URL to the full content",
      "format": "uri"
    },
    "thumbnail": {
      "type": "string",
      "description": "Absolute URL to a thumbnail or cover image",
      "format": "uri"
    },
    "tags": {
      "type": "array",
      "description": "Semantic labels applied to this card (e.g. breaking, new, celebratory)",
      "items": {
        "type": "string",
        "minLength": 1,
        "maxLength": 50
      },
      "uniqueItems": true,
      "maxItems": 10
    },
    "mood": {
      "type": "string",
      "description": "Emotional tone of the content, used to apply mood-based theme styling",
      "enum": ["neutral", "positive", "negative", "urgent", "celebratory", "informational"]
    },
    "region": {
      "type": "string",
      "description": "Geographic region the content is associated with",
      "enum": ["global", "europe", "asia", "africa", "americas", "oceania"]
    },
    "duration": {
      "type": "string",
      "description": "Human-readable duration string, used for podcast and music cards (e.g. '42 min')",
      "maxLength": 20
    },
    "artist": {
      "type": "string",
      "description": "Artist or creator name, used for music cards",
      "maxLength": 100
    },
    "album": {
      "type": "string",
      "description": "Album or playlist name, used for music cards",
      "maxLength": 100
    },
    "author": {
      "type": "string",
      "description": "Author or handle, used for social cards",
      "maxLength": 100
    },
    "likes": {
      "type": "integer",
      "description": "Engagement count (likes, reactions), used for social cards",
      "minimum": 0
    },
    "isLive": {
      "type": "boolean",
      "description": "Whether the card represents an actively live stream or broadcast",
      "default": false
    },
    "viewers": {
      "type": "integer",
      "description": "Current viewer or listener count, used for live cards",
      "minimum": 0
    },
    "aiModel": {
      "type": "string",
      "description": "Name of the AI model that generated or curated the content, used for ai cards",
      "maxLength": 100
    }
  }
}
